{
  "$schema": "./character_instance.schema.json",
  "scenario_name": "fallout",
  "instance_id": "04a1b2c3d4e5f6",
  "stats": [
    {
      "name": "health",
      "value": 87,
      "buff_rate": 1,
      "buff_duration": 0,
      "buff_coefficient": 0.87
    },
    {
      "name": "radiation",
      "value": 12,
      "buff_rate": 0,
      "buff_duration": 0,
      "buff_coefficient": 1
    },
    {
      "name": "strength",
      "value": 5,
      "buff_rate": 0,
      "buff_duration": 420,
      "buff_coefficient": 1
    },
    {
      "name": "armor_phys_resist",
      "value": 15,
      "buff_rate": 0,
      "buff_duration": 0,
      "buff_coefficient": 1
    }
  ],
  "recipes": [
    {
      "name": "mech_core",
      "status": "active",
      "duration_left_sec": 0,
      "uses_applied": 0,
      "uses_left": 0,
      "signature": "ad258f9f"
    },
    {
      "name": "armor_leather",
      "status": "active",
      "duration_left_sec": 0,
      "uses_applied": 0,
      "uses_left": 0,
      "signature": "d7091425"
    },
    {
      "name": "item_speech_strength",
      "status": "active",
      "duration_left_sec": 420,
      "uses_applied": 1,
      "uses_left": 4,
      "signature": "0a449b44"
    },
    {
      "name": "nuka_cola_hangover",
      "status": "active",
      "duration_left_sec": 5400,
      "uses_applied": 0,
      "uses_left": 0,
      "signature": "02c509b0"
    }
  ]
}
